Name,Link,Description
Altern,https://altern.codes,Launch Your AI Tools.
Product Hunt,https://www.producthunt.com,The go-to platform to launch and discover new products.
G2,https://www.g2.com,Software reviews to build credibility and reach businesses.
Trustpilot,https://www.trustpilot.com,Collect customer reviews to establish trust.
StartupBase,https://startupbase.io,A directory for makers to showcase startups.
Launching Next,https://www.launchingnext.com,List your new startup for early adopters.
SideProjectors,https://www.sideprojectors.com,A hub for SaaS side projects.
IndieProducts.io,https://indieproducts.io,"A directory for Indie products, Solopreneurs and Buildinpublic makers."
PeerPush,https://peerpush.com,"Build in Public, Discover & Share Innovative Products."
SaaSHub,https://www.saashub.com,Independent SaaS marketplace.
Zapier Directory,https://zapier.com/apps,Tools integrated with Zapier.
B2B Stack,https://www.b2bstack.com.br,SaaS tools for B2B use.
TapRefer,https://taprefer.com,Biggest directory of affiliate programs.
BetaList,https://betalist.com,Showcase early-stage startups.
AI For Developers,https://aifordevelopers.com,"Access curated AI SDKs, copilots, and APIs to supercharge your development workflow."
There's an AI,https://theresanaiforthat.com,The best AI Tools Directory.
Future Tools,https://www.futuretools.io,Stay up-to-date on AI Tools.
Toolkitly,https://toolkitly.com,"Your Go-To Platform for Tech Tool Discussions, Innovations & Real-Time Updates!"
AppSumo,https://appsumo.com,SaaS deals and promotions.
PitchGround,https://pitchground.com,Lifetime SaaS deals and marketing.
Dealify,https://www.dealify.com,SaaS deals for early adopters.
StackSocial,https://stacksocial.com,Software deals and bundles.
SaaSPromo,https://saaspromo.com,Promote your SaaS with targeted campaigns.
MakerPad,https://www.makerpad.co,No-code tools and SaaS integrations.
NoCode List,https://nocodelist.co,Resources and tools for no-code solutions.
Simple.ink,https://simple.ink,A directory for no-code SaaS builders.
API List,https://apilist.fun,Public APIs for developers.
Remote Tools,https://www.remote.tools,SaaS tools for remote work.
AngelList,https://wellfound.com,Connect startups with investors and talent.
Crunchbase,https://www.crunchbase.com,"Find funding, connections, and partners."
F6S,https://www.f6s.com,Network for founders and resources.
StartupBlink,https://www.startupblink.com,Map of global startups and coworking spaces.
Founder Path,https://founderpath.com,Resources for SaaS founders.
Land-book,https://land-book.com,Collection of SaaS landing pages.
Cool Startups,https://coolstartups.co,Unique startup ideas and showcases.
Startup Lift,https://startuplift.com,Exposure and feedback for startups.
Demos.co,https://demos.co,Showcase SaaS product demos.
Techjury,https://techjury.net,SaaS reviews and insights.
AppRadar,https://appradar.com,SaaS tools for app marketing.
BuiltWith,https://builtwith.com,Discover SaaS products used by websites.
ConfettiSaaS,https://confettisaas.com,Discover Projects that Sparkle with Confetti.
